{
  "id": "require-mfa",
  "name": "Require Mfa",
  "description": "Seed scenario",
  "category": "authentication",
  "tags": [
    "authentication",
    "seed"
  ],
  "steps": [
    {
      "offsetSeconds": 0,
      "eventType": "login.attempt",
      "actorId": "user-1",
      "targetId": "target-1",
      "payload": {
        "mfa": false
      }
    }
  ],
  "expectedRules": [
    "Require MFA"
  ],
  "expectedAction": "Challenge",
  "expectedSeverity": "High",
  "shouldBeCovered": true,
  "shouldBeValid": true
}