{
  "id": "impossible-travel-block",
  "name": "Impossible Travel Block",
  "description": "Seed scenario",
  "category": "authentication",
  "tags": [
    "authentication",
    "seed"
  ],
  "steps": [
    {
      "offsetSeconds": 0,
      "eventType": "login.attempt",
      "actorId": "user-1",
      "targetId": "target-1",
      "payload": {
        "impossibleTravel": true
      }
    }
  ],
  "expectedRules": [
    "Impossible travel block"
  ],
  "expectedAction": "Block",
  "expectedSeverity": "Critical",
  "shouldBeCovered": true,
  "shouldBeValid": true
}